UMAP1,UMAP2,Feature,Density
5.670846,10.591925,Orbital dynamics of small bodies and binaries,0.002147377105939726
10.159801,3.8577528,EDELWEISS dark matter search experiment,0.0021621103965465166
4.544558,9.952891,Spiral structures in astronomy,0.037754057179900845
10.371523,5.1182327,Q-balls in supersymmetric theories,0.0007992810154183887
11.970088,6.3307962,Yukawa gravity and implications,0.0021989436230634932
5.5650177,11.577658,Jupiter's atmosphere and internal structure,0.0023794264329966776
4.382254,9.124687,"2 mm observations, Galactic Center",0.0032302739655388334
5.1866674,7.4657083,TW Hya accretion and variability,0.0027293420849079536
5.486449,7.0230536,PKS 2155-304,0.00558023381732193
8.272521,6.488117,PeV energy astrophysics phenomena,0.014560174442160784
6.9551663,5.1081624,Microwave Zebra Patterns in Solar Flares,0.0024567762086823283
10.017613,3.9433684,XENON dark matter detection experiments,0.0017311616462978923
5.2178683,5.467069,Magnetic Arcades,0.0014217625435552904
4.723531,4.8830357,Protoneutron stars,0.004309487502486243
10.290242,6.26787,Cosmic web connectivity and structure,0.002489926112547607
7.4409595,11.155996,DART mission and Dimorphos impact studies,0.0016980117424326136
10.282653,8.21517,Adaptive Mesh Refinement in RAMSES,0.009617155443582546
8.426616,8.274201,Maser-related topics in astronomy,0.009315122986143341
3.297472,9.270388,Andromeda Galaxy and Dwarf Companions,0.00608116569795281
8.1061735,8.039191,Far astronomical observations/phenomena,0.017167966879562718
9.859973,9.490561,Software and data management in astronomy,0.0034844232285059706
9.7586155,9.505569,3D techniques in astronomy,0.02819215157609376
9.973082,4.0315733,DAMA/LIBRA annual modulation signature,0.0031271409312912993
7.5760493,9.030746,Identification of Unidentified Gamma-Ray Sources,0.00314187422189809
4.955277,10.911215,Planetesimal formation processes,0.0060038159222671585
7.419442,9.596609,XMM-Newton Observatory,0.02059714026829322
7.2348065,10.093457,IRAS and infrared astronomy,0.03914635314224255
9.784646,4.2235317,Extreme Energy Cosmic Rays and Dark Matter Detection,0.0018858611976691935
5.9704957,11.263072,Detailed studies of Mercury's physical and dynamical properties,0.001631711934702056
5.7799306,10.765446,Thermal inertia of asteroids,0.0019889942319167276
10.469018,6.8311825,Persistent homology in cosmic structures,0.002033194103737099
9.8065605,10.632008,Specific observational data and analysis techniques,0.0016501285479605442
10.222472,7.4430656,Advanced hydrodynamic simulation codes in cosmology,0.004861985900240889
10.555571,6.4943376,Cosmic topology and its implications,0.0030939910274260206
7.2211194,7.0550103,Lithium (Li) in astrophysical contexts,0.0066557640316176414
6.431262,11.229709,Apophis 2029 close approach analysis,0.0010202803745202472
6.833816,4.8810086,Solar Active Regions and Magnetic Activity,0.011760849226870575
8.703135,10.657914,ASICs in detector readout systems,0.001322312831959454
11.061517,6.667783,Bulk Flow in Cosmology,0.005860166338850951
10.389151,4.978148,Neutralino dark matter in supersymmetry,0.00514191842176991
11.011661,7.4021363,Parameter estimation in cosmology,0.0016059286761401725
8.569447,5.1980867,Propagation of ultra-high-energy cosmic rays,0.01683646784090993
12.060488,6.371057,Horndeski gravity and extensions,0.0019374277147929605
3.4753392,7.2336354,Wolf-Rayet stars,0.003941155237316478
10.329545,9.04103,Software and computational tools in astrophysics,0.0024972927578510024
5.378204,11.861263,Habitability of exoplanets with climate models,0.0042210877588454996
9.313176,10.351846,Redundant calibration in radio interferometry,0.0014954289965892432
5.1130767,9.592142,Dynamics and structure in cosmic matter,0.006327948315616551
8.9534855,7.2700725,Hanle Effect in Astrophysics,0.0015875120628816844
7.773794,9.348346,Fermi Gamma-Ray Space Telescope (Fermi LAT),0.011046284632441233
10.125034,6.162149,Affleck-Dine Mechanism in Cosmology,0.0014659624153756622
3.2829418,9.314356,Phoenix Dwarf Galaxy,0.0030240078970437652
8.21818,7.706745,Rest-frame properties,0.006976213102315337
5.196356,6.7046275,GRO J1655-40,0.0025451759523230717
6.530108,11.392013,Comet 17P/Holmes outburst events,0.002073710652905773
4.817217,10.532224,Dead zones in protostellar disks,0.0012154964750602222
10.858098,10.410949,Historical and cultural astronomy,0.0024972927578510024
4.773222,9.357113,Mass estimation of galaxy clusters,0.0015064789645443362
4.2678742,7.7511835,Population III stars,0.0033039404185727862
8.327088,6.972476,Diffusion processes in astrophysics,0.011005768083272558
4.980732,4.8035583,"Neutron matter, three-nucleon interactions, finite temperature",0.00270355882634607
9.233337,10.767391,Upgrades to astronomical instruments,0.002850891732413976
4.320984,9.913327,Galactic Bulge,0.0024420429180755376
6.6422286,11.34241,Comet 67P/Churyumov-Gerasimenko studies,0.00725246230119266
8.96171,7.270821,Alignment phenomena in astrophysics,0.017116400362438947
4.4485817,7.620769,Runaway Greenhouse Effect,0.0034144400981237152
8.748556,4.1205697,IceCube Neutrino Observatory,0.004696236380914496
7.791598,7.862719,Bipolar outflows in astronomy,0.0073003454956647295
10.404432,8.101325,Mathematical methods in gravitational/magnetic fields,0.004084804820732687
8.668245,4.394402,ANITA experiment and UHE neutrinos,0.0012302297656670129
2.8777404,8.578424,M 67 (NGC 2682),0.01223968117159127
4.923246,10.665776,HR 4796A circumstellar disk studies,0.002136327137984633
4.06385,5.2048492,Pulsar glitches and their analysis,0.005676000206266068
7.5351,11.28556,CubeSats in scientific missions,0.0016390785800054514
7.8942657,9.806999,Tokyo axion helioscope experiments,0.0021252771700295404
4.239345,6.841883,Donor stars in binary systems,0.005491834073681186
5.913823,12.134833,Proxima Centauri and its exoplanet,0.0036317561345738762
7.531876,6.573806,Coulomb Dissociation of 8B and S17,0.0030718910915158346
5.019066,8.420067,"Star-forming regions, young stellar populations",0.0038674887842825257
10.80719,8.013467,Maximum Entropy Method (MEM),0.0015138456098477315
10.5073395,8.744354,Use of MESA code in astrophysics,0.0030424245103022533
7.5917025,8.999801,EGRET gamma-ray source identification,0.00418793785498022
4.3061028,5.4906216,High-energy phenomena in millisecond pulsars,0.006578414255931991
8.561861,7.1086817,Saturation mechanisms in astrophysics,0.005326084554354792
4.5732,7.9663825,HOPS protostars and their SEDs,0.001756944904859776
5.460805,3.9579444,X-ray reverberation lags in black holes,0.0025893758241434433
7.4025474,9.890929,Sloan Digital Sky Survey (SDSS),0.02353643174434794
6.0279803,12.259453,Discovery of HATSouth transiting exoplanets,0.0014328125115103832
4.875503,10.576487,Snow lines in protoplanetary disks,0.0028545750550656736
4.4625907,10.2967005,Cardassian expansion model,0.0013775626717349187
11.457218,6.3483095,Tensor-Vector-Scalar (TeVeS) theory,0.0020589773622989825
6.896667,8.220899,Thiols in ISM chemistry,0.002268926753445748
6.931312,7.564795,Deuterium to Hydrogen Ratio (D/H),0.0013775626717349187
9.734672,7.211999,Stationary states or models in astrophysics,0.0060443324714358326
9.24422,10.816595,GREGOR solar telescope and instruments,0.0028251084738520923
3.222931,5.5009966,Kilonovae from neutron star mergers,0.002232093526928772
3.595641,8.737122,Sgr A East,0.0021842103324567026
3.7716875,9.674739,Isolated galaxies in AMIGA project,0.0009981804386100615
6.6281605,11.208921,Asteroids and NEOWISE Mission,0.0015875120628816844
10.170068,7.4502926,Smoothed Particle Hydrodynamics (SPH),0.004766219511296751
4.033149,7.545743,Asymptotic Giant Branch (AGB) Stars,0.00833167583814007
8.025339,8.094469,Equatorial observations and phenomena,0.0033113070638761816
8.891799,6.4799786,Instabilities in protoplanetary discs,0.018320846869544077
10.3974695,4.1649456,Dark matter halos,0.017679948728148688
4.6820664,3.1065633,Overlapping signals in gravitational wave detection,0.0021252771700295404
8.477142,5.254306,Knee in cosmic-ray energy spectrum,0.0025267593390645832
2.91964,7.3844004,Pulsar Wind Nebulae (PWNe),0.0016648618385673348
9.648925,9.525511,CLEAN algorithm in radio imaging,0.0031087243180328112
7.6660013,10.37547,MOST satellite observations,0.005790183208468695
7.378432,7.8465056,Fullerenes in space environments,0.013105261994740216
4.094576,5.203706,Pulsar glitches and neutron star dynamics,0.003027691219695463
10.08348,9.528049,Stacking techniques in astronomy,0.009653988670099523
8.739024,8.393022,Dispersion in Astronomy,0.027286054203776142
10.166667,7.675793,Geant4 simulation toolkit,0.0025046594031543977
11.05566,6.9987774,Spectral Index \( n \) in Cosmology,0.014578591055419273
3.5646496,8.55479,30 Doradus and R136 star cluster,0.0020405607490404944
6.9868813,8.088652,Molecular outflows in astronomy,0.00457837005606017
8.421506,2.6250067,Gravitational lensing of quasar Q0957+561,0.0012965295733975706
10.314892,10.388703,Education and outreach in astronomy,0.0031639741578082755
4.0915065,5.1956944,High-precision timing of pulsars,0.0018932278429725888
4.1100187,7.534815,Circumstellar environment of AGB stars,0.001786411486073357
8.993808,10.684284,Bolometers and their applications,0.009547172313200292
3.7728813,8.514606,Blanco 1 star cluster,0.0033518236130448556
8.599183,5.1623735,Ultra-High Energy Cosmic Rays (AGASA),0.002880358313627557
10.400466,6.0975933,Instantons in cosmological quantum tunneling,0.0019447943600963556
4.363973,8.636987,ρ Ophiuchi Cloud,0.006302165057054668
10.925283,6.905396,FLRW cosmological model,0.00314187422189809
8.919951,5.9614215,Sausage and Kink Modes in MHD,0.002777225279380023
10.656738,7.261589,Cosmological simulations and large-scale structure,0.0018453446485005194
9.957011,9.401519,Software tools for astronomy data analysis,0.002353643174434794
8.440587,7.197996,Specific astrophysical phenomena and processes,0.0021436937832880285
10.106077,8.745896,Groundbreaking astrophysical discoveries and theories,0.0016353952573537538
4.4239097,8.159523,Young stars with circumstellar disks,0.0032081740296286475
8.453016,9.154126,Line Intensity Mapping (LIM),0.0010460636330821306
4.607019,9.64112,Galaxy bias and cosmic structure,0.026427840025930592
3.744684,9.371599,Blue Compact Dwarf Galaxies (BCDs),0.0015359455457579173
10.403546,6.4696746,Theoretical properties of spacetime,0.009849204770639499
5.712496,7.2666054,"Blazars, BL Lacs, FSRQs, gamma-ray emissions",0.0035028398417644587
11.058325,9.498087,Machine learning in astronomy,0.001970577618658239
2.7019835,5.5207872,Supernova 2011dh observations and analysis,0.0021878936551084
5.121893,8.580307,Star formation processes and conditions,0.0881566443457314
4.933545,4.802083,Bulk viscosity in neutron stars,0.0023094433026144222
7.2076073,6.0454297,"NGC 5905, Tidal Disruption Events",0.002663042277177396
4.507522,7.2674303,Barium stars and related phenomena,0.003738572491473108
5.0318756,8.202614,Nearby stellar systems and trigonometric parallaxes,0.002552542597626467
9.170386,4.6046147,"Photon-neutrino interactions, Standard Model calculations",0.002011094167826913
7.2225747,5.0034766,Magnetic switchbacks in solar wind,0.0013701960264315234
9.076868,7.3435698,Chameleon fields in astrophysics,0.001955844328051449
8.404345,4.939395,PAMELA experiment and positron excess,0.0035433563909331328
4.2461076,7.8735905,Red clump stars,0.040383949553212964
4.508293,9.827726,Interloper galaxies and bias correction methods,0.002803008537941907
7.832296,6.657623,Nuclear physics in astrophysical contexts,0.00450102028037452
8.464518,9.203065,Line Intensity Mapping (LIM),0.0021768436871533073
11.169894,7.070256,Jerk parameter in cosmology,0.0011933965391500365
11.081464,6.285446,Brane-world cosmology,0.003948521882619874
3.857785,9.406753,Detailed studies of individual galaxies,0.06101055640271977
5.708218,11.563679,Titan's atmosphere and methane studies,0.0019337443921412629
10.462778,5.064009,Minimal Supersymmetric Standard Model (MSSM),0.0023573264970864916
10.801,10.411183,Historical and observational astronomy,0.002169477041849912
8.30875,9.864671,Atacama Cosmology Telescope (ACT),0.0025157093711094904
3.7460492,7.6987886,Blazhko effect in RR Lyrae stars,0.0026777755677841867
5.2863894,7.72222,Extended Main-sequence Turnoff (eMSTO),0.001104996795509293
11.105856,6.6199384,Isocurvature perturbations in cosmology,0.003801188976551968
9.52215,8.489723,Fundamental Plane in Astronomy,0.012195481299770897
6.4298396,4.951681,"Historical solar observations, sunspots, solar activity",0.004320537470441335
11.271127,6.608812,Normalizing Flows,0.0019484776827480533
5.6103444,5.9332657,Gamma-Ray Bursts and Host Galaxies,0.004722019639476379
6.654846,7.535032,Titan,0.0012633796695322916
4.730897,3.1516404,Gravitational wave source localization,0.002530442661716281
8.229445,7.214585,Optical properties of porous particles,0.003396023484865227
5.9038897,11.658453,Infrared phase curves of hot Jupiters,0.0109431515981937
8.436624,10.383352,AREPO code and its applications,0.0016390785800054514
6.106909,11.497956,Uranus and its satellites,0.0015433121910613126
5.904061,10.846402,Asteroid families and dynamics,0.003101357672729416
7.7873144,5.6428533,Magnetic field reversals,0.0033923401622135297
9.099661,8.279137,CMB Polarization Measurement Instrumentation,0.0017422116142529853
4.7995276,7.1791444,Cepheid Variables and Their Properties,0.005145601744421608
7.514762,6.2752695,Tidal forces and interactions in astrophysics,0.03117932624662055
6.7558455,5.0581865,Solar flares and chromospheric phenomena,0.005377651071478559
7.5254116,11.299444,Space missions and scientific instruments,0.001499112319240941
10.671555,7.018503,Fundamental constants and cosmological models,0.003812238944507061
10.495949,8.565824,Computational and Analytical Methods in Astrophysics,0.003377606871606739
9.337332,10.936546,NEWS instrumentation and experiments,0.0013259961546111516
10.942923,6.4075046,Topological defects in cosmology,0.008228542803892536
6.8907595,4.86355,Fibrils in the solar chromosphere,0.0014659624153756622
7.2885838,7.403261,Titanium compounds in astrophysics,0.004280020921272661
3.6430643,6.690378,White dwarfs,0.008733158007175112
5.398274,4.190649,Intermediate-Mass Black Holes (IMBHs),0.003738572491473108
4.770678,7.104089,SW Sex stars in cataclysmic variables,0.0008213809513285744
10.12717,3.883766,DEAP-3600 dark matter experiment,0.0014733290606790573
4.777668,3.2314262,Taiji mission and gravitational waves,0.0011123634408126883
6.4788027,8.6188,Radicals in the interstellar medium,0.0016280286120503584
4.0778418,8.06761,Blue hook stars in globular clusters,0.0008250642739802721
5.555549,5.87448,Spectral width in GRBs,0.007528711500069983
7.2173247,10.116907,Infrared observations in astronomy,0.09662828644463597
5.580664,3.9410293,Thermodynamics in black holes and entropy,0.005208218229500468
10.799299,6.400776,Cosmological Singularities,0.008210126190634047
10.762248,8.428379,Nested sampling in Bayesian inference,0.002209993591018586
10.382764,4.1714168,Excursion Set Theory in Dark Matter Halos,0.0016980117424326136
3.9509287,9.327059,Hickson Compact Groups (HCGs),0.0010018637612617591
9.128485,8.324531,CLASS telescope CMB polarization observations,0.0035654563268433187
8.803488,4.1178174,KM3NeT infrastructure and activities,0.002913508217492836
9.208572,4.416259,Neutrino-related topics in astrophysics,0.04572476739817455
8.8453665,9.757684,Lucky Imaging Techniques,0.0028766749909758596
5.993192,8.168074,"High-redshift, X-ray luminous, radio-loud quasars",0.004265287630665871
8.406479,2.6594436,"Gravitationally lensed quasars, time-delay measurements",0.0015617288043198007
10.094985,3.9831054,Annual modulation in ANAIS-112 dark matter detection,0.002213676913670284
9.546073,10.220517,Telescope scheduling and optimization algorithms,0.004213721113542104
8.483755,2.5459602,Gravitational lensing arc statistics,0.0038269722351138517
5.9762316,6.461015,Fast Blue Optical Transients (FBOTs),0.001145513344677967
4.758088,7.8085585,H II regions and associated phenomena,0.0035028398417644587
7.9159694,10.11228,Grating technology in X-ray/UV spectroscopy,0.0032081740296286475
8.448374,7.021096,Hysteresis in astrophysical phenomena,0.0029282415080996264
10.289937,3.8279805,MIMAC project and directional dark matter detection,0.0026188424053570246
5.579287,9.997678,Dust grains in astrophysical environments,0.015304205617803709
9.50775,10.727,Instrumentation and Calibration in Astronomy,0.002449409563378933
8.773533,7.195856,Boosting effects in astrophysics,0.006401614768650504
11.066759,7.3262115,Cosmological parameter estimation and constraints,0.015274739036590127
8.299066,6.6824274,Electron dynamics in astrophysical contexts,0.028000618798205486
7.8688188,6.6285496,Ionization in astrophysical contexts,0.04096591453218119
7.479468,7.1296105,Cyclotron resonance and harmonics,0.0015433121910613126
10.508116,7.7830315,Symplectic integrators in N-body simulations,0.009679771928661407
5.137944,8.443272,Filamentary structures in star formation,0.006497381157594643
10.290753,3.95484,Dark matter detection at LHC,0.0024236263048170495
2.7836301,5.6128035,Superluminous supernovae light curve features,0.005852799693547555
7.172188,8.373604,Methanol detection and emission in astronomy,0.003970621818530059
7.958424,10.681666,Very Long Baseline Interferometry (VLBI),0.014048192593574812
8.220866,6.231698,Radion in extra-dimensional cosmology,0.0020442440716921923
7.9972873,10.5956745,Very Large Array (VLA) related content,0.014821690350431318
10.245186,3.8346515,Direct WIMP dark matter detection experiments,0.0028545750550656736
6.783841,4.9949346,Solar photosphere energy flux and fields,0.007020412974135708
3.3694289,9.067831,Andromeda Galaxy (M31),0.008747891297781902
5.1468544,7.8513803,Limb darkening in stellar models,0.0024162596595136542
7.644479,8.854606,Mkn 421 high-energy observations,0.007753394181823539
9.254031,10.654177,Development of astronomical facilities and infrastructure,0.0037975056539002704
4.6147537,6.675783,Accreting white dwarfs and pulsations,0.0025230760164128858
4.6754513,9.159656,Galaxy halos and interactions,0.03522729784083626
6.333994,4.6672997,Penumbra formation in sunspots,0.002268926753445748
9.381322,7.920351,Ratios in Astrophysical Measurements,0.03710579239320206
7.6717515,9.861336,Nancy Grace Roman Space Telescope studies,0.0015617288043198007
6.5439053,9.749026,GALAH Survey and related studies,0.0018600779391073098
7.1563497,9.756816,Multi-wavelength observations of galactic structures,0.012630113372671219
4.753687,7.9164987,Prestellar cores and their properties,0.0024346762727721423
7.520612,10.191675,Vector vortex coronagraphs in mid-IR,0.0034254900660788084
8.768735,7.415518,Bimodality in astrophysical phenomena,0.0037754057179900844
8.948659,10.031428,Wavefront error control in segmented telescopes,0.003749622459428201
8.561873,5.6096015,Hadronic interaction models in cosmic rays,0.0029577080893132077
7.5529876,7.1128974,Cyclotron Resonance Scattering Features (CRSF),0.003617022843967086
8.8922415,7.550764,Anisotropy in astrophysical phenomena,0.04544483487664552
5.8993087,10.7223835,YORP effect in asteroids,0.0023204932705695154
9.166213,4.478469,Neutrino interactions and nuclear physics in astrophysics,0.0014806957059824526
5.3591833,11.789812,Planetary atmospheres and habitability,0.00365753939313576
5.777526,12.069169,HR 8799 exoplanet system,0.002232093526928772
5.011092,11.041187,Terrestrial planet formation and evolution,0.003513889809719552
4.832371,4.8030233,Deconfinement phase transition in neutron stars,0.0014180792209035928
9.741206,7.7324476,Projection factor in Cepheid distance measurement,0.0008618975004972486
7.468862,7.427803,Forsterite in astrophysical contexts,0.0017385282916012876
7.196735,10.117016,International Celestial Reference Frame (ICRF),0.004379470632868498
6.022036,7.84359,MCG-6-30-15 X-ray spectral variability,0.004025871658305524
9.34466,10.988591,FORS instrument studies,0.0050940352272978405
11.070177,5.6703277,Jordan frame in supergravity and inflation,0.0015138456098477315
7.386083,10.091255,Deep coadded full-sky infrared maps,0.0026372590186155126
6.0539823,11.424025,Uranus-specific content,0.0019779442639616344
10.314524,6.2019773,Cosmic string network dynamics,0.003613339521315388
10.305199,3.796188,WIMPs and dark matter detection,0.01803723102536336
8.093179,7.0159326,Advection-Dominated Accretion Flows (ADAFs),0.00565758359300758
5.9828987,12.296743,"Transiting exoplanets, TTVs, RV measurements",0.004792002769858634
7.284291,6.4061556,Nuclear processes involving isotopes and nuclides,0.020777623078226407
10.28632,10.268939,Ethical and social responsibility in astronomy,0.0024641428539857236
4.4531646,5.0352683,Spin-down/up of neutron stars/pulsars,0.016298702733762074
4.8621545,10.7725525,Planetary migration in protoplanetary discs,0.0033076237412244837
8.819355,10.005201,Adaptive Optics Lucky Imager (AOLI),0.0013259961546111516
10.153378,9.802938,Software citation and credit in astronomy,0.002213676913670284
7.6748857,5.933517,Molecular ions in strong magnetic fields,0.003572822972146714
9.484125,9.046175,Parsec-scale observations in astronomy,0.005801233176423788
6.2963805,7.6805887,TANAMI Program,0.0016022453534884748
6.765158,7.028944,Fluorine abundance and chemical evolution,0.0013259961546111516
5.192382,7.873664,Stellar evolution models and isochrones,0.0019337443921412629
4.4914656,7.372028,Be stars and related phenomena,0.0044457704405990554
9.667797,9.86054,Corrections and measurements in observational astrophysics,0.00231312662526612
10.103321,9.139237,Shapelets in image analysis,0.002541492629671374
6.2243342,10.978262,Asteroid (16) Psyche,0.0020810772982091685
5.180167,7.7193747,Young Stellar Objects (YSOs) and variability,0.0048767191908476795
11.202881,6.3463306,Higgs field in cosmology,0.005790183208468695
7.2738347,11.068112,IBEX mission and heliosphere studies,0.000681414690564064
6.774332,4.2686706,Coronal and electron holes in solar context,0.006512114448201434
7.8749,7.5255466,Ambipolar diffusion in molecular clouds,0.0020037275225235182
4.1950607,5.4112606,Pulsars and multi-wavelength observations,0.003605972876011993
5.9375753,8.062549,Obscuration in Active Galactic Nuclei (AGN),0.0053960676847370475
7.628679,7.1098256,Potassium in astrophysical contexts,0.0008839974364074345
7.5625286,11.258707,CubeSats and their applications,0.0023904764009517704
2.6397734,5.4080243,Type Ia Supernovae (SNIa) in Cosmology,0.005082985259342748
11.923721,6.468066,Modified gravity theories in cosmology,0.008589508423758904
4.9969683,9.036999,Gas sloshing in galaxy clusters,0.0010460636330821306
5.112045,9.263356,Cold fronts in galaxy clusters,0.0026114757600536292
10.545765,8.299972,Computational methods and simulations,0.0017643115501631713
5.4473124,6.7603817,Flare activity in M dwarf stars,0.03562141336456791
7.631614,10.15111,James Webb Space Telescope (JWST),0.0060038159222671585
4.1471486,5.2950134,Braking index in pulsars/magnetars,0.004762536188645053
7.28355,9.066052,X-ray Flashes (XRFs) and Properties,0.0033702402263033437
8.629219,5.023055,Extensive air shower simulations,0.0022799767214008414
8.441465,9.002694,Wilkinson Microwave Anisotropy Probe (WMAP) Observations,0.0025967424694468386
6.5286527,5.0842514,Predictions of Solar Cycle 25,0.0019632109733548437
5.436486,7.728258,Stellar Parameter Pipeline (SSPP),0.002769858634076628
8.369054,8.378422,Historical astronomical events and stellar flares,0.0026593589545256986
4.6040096,7.958775,Class 0 protostars,0.006117998924469786
5.590984,5.898461,Gamma-ray bursts in cosmology,0.003977988463833455
5.9494267,12.239988,Exoplanet and variable star detection,0.00231312662526612
7.2012587,7.65418,Carbon in Astronomy,0.013978209463192557
5.8723006,10.524572,Detailed study and classification of orbits,0.05515775670917221
6.851597,5.273115,Solar flares and X-ray/EUV observations,0.0036096561986636907
10.080802,6.66807,Cosmic Birefringence,0.003823288912462154
4.2871027,9.600534,Kinematic classification of early-type galaxies,0.0024641428539857236
6.7307186,6.6553884,Big Bang Nucleosynthesis (BBN),0.005547083913456651
7.7185845,5.870972,Self-force in EMRIs (Schwarzschild/Kerr),0.0020074108451752157
11.118897,5.643536,Natural Inflation Theory,0.005245051456017444
5.9715185,11.439648,Pluto-Charon system studies,0.001292846250745873
9.177211,4.329048,Mass Varying Neutrinos (MaVaNs),0.0014364958341620809
4.172761,6.8898745,Capella binary star system,0.002744075375514744
10.203849,7.847382,Theoretical and Mathematical Astrophysics Concepts,0.0019816275866133323
9.794068,7.75247,Opacity calculations in astrophysics,0.0016759118065224278
6.915327,7.484694,Isotopic ratios of carbon and oxygen,0.005981715986356973
5.2303863,6.5991235,GRS 1915+105,0.003333406999786367
8.764986,4.645728,High-energy neutrino and cosmic ray fluxes,0.0050535186781291664
4.3108063,7.236263,Gravastars,0.002570959210884955
4.1448784,5.366751,Super-puffs and their characteristics,0.003215540674932043
3.754563,8.551891,R136 star cluster,0.004998268838353702
8.473528,10.885453,Kinetic Inductance Detectors (KIDs),0.0018600779391073098
10.351223,3.9091275,Directional detection of dark matter,0.0012412797336221059
10.800419,7.309313,Large-scale structure and statistical methods in cosmology,0.006412664736605597
10.077401,9.885797,Erratum notices in astronomy papers,0.0017495782595563806
5.5935407,5.8568068,Gamma-Ray Bursts and Cosmic Rays,0.0035433563909331328
7.613118,8.572576,Detailed spectral analysis of specific stars,0.0020295107810854016
11.036599,6.7020354,Curvaton model in cosmology,0.0032376406108422288
8.717729,9.252893,Tilt-to-Length Coupling in Interferometry,0.0025562259202781645
7.1452656,10.244178,Earthshine and SHINE survey observations,0.002033194103737099
8.000286,7.046194,Bondi accretion,0.0041842545323285225
5.458127,6.265371,LS I +61 303 TeV gamma-ray emissions,0.0021031772341193545
