UMAP1,UMAP2,Feature,Density
8.075852,5.8586946,Ionosphere and radio wave interactions,0.004954068966533331
5.5750656,4.006824,Black hole spin,0.004843569286982401
4.273609,7.434165,T Tauri stars and phenomena,0.006755213743213478
4.1268797,9.541649,Early-type galaxies (ETGs),0.004250554340059081
5.0478477,7.5164256,Mira variables and related phenomena,0.002232093526928772
6.2503743,10.976521,Asteroid (16) Psyche,0.0012191797977119199
8.329011,7.0296326,Evaporation in astrophysical contexts,0.009333539599401829
8.560971,5.159235,Ultra High Energy Cosmic Rays (UHECRs),0.0043978872461269865
7.0342355,5.289787,Whistler waves in solar wind,0.0009834471480032708
10.7306,6.8396273,Spectator fields in cosmology,0.001694328419780916
8.71335,7.4045196,Universality in astrophysical phenomena,0.012169698041209013
6.7963376,5.0277376,Footpoints in Solar Flares,0.0020921272661642613
7.535678,9.714308,"X-ray SOI sensors, actinides, spectroscopy",0.004338954083699824
9.370529,10.440967,Telescope design and projects,0.020784989723529802
4.23534,9.3811035,Clusters of Galaxies and Software Tools,0.0021105438794227498
9.607909,5.4658246,Color superconductivity in quark matter,0.0014475458021171738
4.8219934,7.6146884,Variable stars and asteroids,0.0023389098838280035
10.566704,4.185616,Dark matter interactions with mediators,0.0025341259843679785
5.371953,6.7759876,SAX J1808.4-3658 and related phenomena,0.002346276529131399
11.05891,6.689589,Inhomogeneities in cosmological models,0.01921221095125491
10.076832,5.016834,Peccei-Quinn mechanism and axion-related phenomena,0.0030019079611335792
4.441243,7.4139247,β Pictoris and associated phenomena,0.0013775626717349187
10.011579,9.685468,Advanced technological applications in astronomy,0.002983491347875091
5.521981,7.9795465,Stellar angular diameters via interferometry,0.0024825594672442117
6.6242414,8.631277,Intracluster Medium (ICM),0.009698188541919894
8.29841,9.615487,NectarCAM for Cherenkov Telescope Array,0.0011639299579364554
10.788807,5.9742427,Positivity bounds in EFTs,0.0012339130883187105
5.963413,9.481694,Ultra-compact astronomical objects and regions,0.002489926112547607
4.728645,3.1602592,GRANDMA network and gravitational-wave follow-up,0.0009245139855761085
8.471116,4.957338,Pierre Auger Observatory and cosmic rays,0.0028950916042343477
3.9530423,8.545644,Open Clusters in Astronomy,0.006331631638268249
11.141241,6.5791445,Lagrangian displacement field in cosmology,0.0020810772982091685
8.241692,6.84903,Fusion processes in astrophysics,0.0037422558141248057
4.9287505,4.805945,Nuclear pasta in neutron stars,0.0015875120628816844
9.022876,6.9552507,Dynamo theory in astrophysics,0.011333583799273649
9.633041,5.637954,Superconducting parametric amplifiers and quantum noise,0.0018969111656242865
8.448439,10.032318,Pierre Auger Observatory research,0.0033812901942584365
6.5323515,4.7999954,Detailed sunspot structure and dynamics,0.005723883400738138
2.6011894,5.3844295,Double Degenerate Binaries in Type Ia Supernovae,0.001941111037444658
7.0486755,8.788706,FLAMES spectroscopic observations,0.003675956006394248
5.5134373,12.028234,Transmission spectroscopy of exoplanet atmospheres,0.004357370696958312
8.745082,4.119234,IceCube Neutrino Observatory at ICRC,0.0016022453534884748
5.5690985,6.6345825,Quasi-Periodic Pulsations in Flares,0.001941111037444658
5.819524,9.045596,High-redshift protoclusters and their evolution,0.0019190111015344722
5.9349146,11.402449,Ganymede-related studies,0.0009723971800481778
6.590641,4.9784436,Solar minimum and Maunder Minimum phenomena,0.002283660044052539
5.9396443,11.530321,"Planetary albedo, obliquity, and phase curves",0.004379470632868498
4.9323263,5.043303,Neutron star mergers and GRBs,0.00642371470456069
4.9024625,10.720949,Transition disks and planetary formation,0.002331543238524608
3.9401925,7.3971,γ Doradus and AB Doradus stars,0.0036649060384391554
7.302585,6.084098,Tidal Disruption Events (TDEs),0.0025746425335366526
6.720454,6.9781594,Hoyle state and scandium studies,0.0024604595313340257
8.69642,8.098071,Intermediate polars and polars,0.0016243452893986608
5.336776,3.908214,Ringdown phase of black hole mergers,0.0012744296374873846
8.095436,9.096412,Laue and Fresnel lenses in gamma-ray astronomy,0.0039669384958783615
4.901976,11.670174,Radial velocity in close binaries,0.002633575695963815
8.687052,6.8240285,Particle creation and dynamics in astrophysical contexts,0.05007108812717776
11.050313,7.183456,Genus Statistics in Cosmology,0.0011418300220262694
6.4970903,5.617876,Birmingham Solar-Oscillations Network (BiSON),0.001116046763464386
10.248684,4.6318793,Axions in dark matter context,0.023676398005112453
4.8771806,10.753899,Planetesimal formation in protoplanetary disks,0.0038969553654961066
6.436056,8.130187,UVES/VLT high-resolution quasar absorption studies,0.002696192181042675
5.577437,6.63648,Quasi-periodic pulsations in flares,0.005189801616241979
8.691047,4.3812394,ARIANNA experiment detecting UHE neutrinos,0.0016280286120503584
10.359164,6.1135225,"Black holes, gravitational waves, quantum cosmology",0.0031345075765946947
4.147793,6.6586094,Third bodies in binary systems,0.016869617744775207
6.8263493,4.335504,Coronal loops and transverse oscillations,0.002976124702571696
10.312748,10.415953,Astronomy education and outreach activities,0.0026556756318740007
6.746337,8.367501,Desorption mechanisms in interstellar medium,0.001292846250745873
6.783688,4.103783,Coronal Mass Ejections (CMEs),0.006298481734402971
7.505026,9.602841,Spectrometer/Telescope for Imaging X-rays (STIX),0.0017090617103877066
9.532048,9.587821,FITS data format and limitations,0.002014777490478611
4.9876246,4.8093696,Neutron skin thickness in heavy nuclei,0.0009318806308795038
4.222182,5.5004225,X-ray pulsar timing and spectral properties,0.006755213743213478
6.1879506,7.86115,Broad Absorption Line Quasars (BALQSOs),0.0021105438794227498
5.4759283,6.8928695,Granulation and its dynamics,0.0070425129100458944
5.043073,7.872849,Stellar objects and observational studies,0.002486242789895909
6.836469,4.810223,Active Region Moss in Solar Physics,0.0018121947446352407
8.91624,5.957651,Magnetohydrodynamics and Plasma Physics,0.0019632109733548437
10.182012,3.8372023,EDELWEISS dark matter search experiment,0.002106860556771052
4.3701334,9.852778,Intrinsic Alignments of Galaxies,0.0017900948087250547
7.532131,10.545656,ORFEUS II mission and Echelle spectrometer,0.002213676913670284
11.87218,6.408123,Gravitinos in cosmology,0.0024420429180755376
7.149286,9.2229395,Ultraviolet (UV) Astronomy,0.003793822331248573
8.711117,8.531566,Period determination in astronomy,0.006762580388516873
10.804691,6.6423116,Cyclic universes and multiverse theory,0.006335314960919947
3.601236,9.626265,Dwarf galaxies and their properties,0.06245441888218524
4.717197,9.180686,Galaxy interactions and gas dynamics,0.001414395898251895
5.826372,12.272177,Exoplanet detection around M dwarfs using RV.,0.0011234134087677813
4.9684024,8.944276,Galactic fountains and high-velocity outflows,0.0024604595313340257
11.060248,5.7567134,Cosmological attractors in inflationary models,0.005513934009591372
3.7378922,9.509103,Ultra-Compact Dwarf Galaxies (UCDs),0.0022799767214008414
6.7818985,4.2685614,Coronal rain in solar corona,0.0023020766573110273
4.851398,10.636101,Photoevaporation of protoplanetary disks,0.003097674350077718
4.9720707,11.750864,CORALIE spectrograph and radial velocity measurements,0.002213676913670284
9.076799,9.060739,Aperture Effects in Astronomy,0.0037201558782146197
6.5429106,8.283609,O VI absorption in interstellar medium,0.002758808666121535
10.047257,7.8210893,Detailed modeling of astrophysical processes,0.003513889809719552
4.9624825,4.8099995,Neutron star properties and nuclear matter,0.002331543238524608
3.4477415,7.196903,"Wolf-Rayet (WR) stars, WN subtype",0.0022173602363219813
6.983515,8.881371,Ultraluminous X-ray Sources (ULXs),0.003510206487067854
9.426082,9.566149,Bandpass filters in astronomy,0.05073776952713504
6.5851483,4.8535585,Solar prominence threads,0.0012228631203636175
9.8789425,8.85147,Spatial statistics in astronomy,0.018987528269501352
9.639904,6.770206,Burgers equation in fluid dynamics,0.0019853109092650297
5.9855666,12.231607,HATNet project and exoplanet discoveries,0.0033407736450897624
4.178516,5.3727226,Pulsars,0.004895135804106168
10.453682,6.225275,Symmetron field and related concepts,0.0016464452253088465
8.896311,9.729943,Technical aspects of pixelation,0.004475237021812637
11.9099655,6.3089123,Gravitational Theory and Relativity,0.003572822972146714
11.166058,7.24228,Cosmic chronometers and Hubble parameter,0.0031750241257633687
9.089001,7.0326633,κ-distributions in astrophysics,0.0032707905147075075
8.162099,7.9142385,Unique or Rare Astronomical Phenomena,0.002508342725806095
4.4126215,8.61371,Lupus Molecular Cloud Complex,0.0027735419567283255
11.323736,6.307913,Brans-Dicke theory and scalar field,0.0020589773622989825
8.130332,8.093853,Night-time phenomena in astronomy,0.0031050409953811134
5.7863665,10.896403,Centaurs and their dynamical behavior,0.001362829381128128
8.38565,8.950215,Wilkinson Microwave Anisotropy Probe (WMAP),0.0040516549168674075
3.2359793,8.882769,Tarantula Nebula (30 Doradus) in LMC,0.0010129137292168519
3.5733273,9.261919,Malin 1 galaxy studies,0.0017422116142529853
5.6676373,10.632837,Periodic orbits in three-body problem,0.0020921272661642613
10.749542,7.991516,MIT bag model,0.0012007631844534318
3.4568276,8.959454,Andromeda Galaxy (M31) Studies,0.01533367219901729
6.0611444,10.906939,Asteroid families and classification,0.00900204056074904
4.381847,9.238853,Galactic Center phenomena and structures,0.043345340965177864
7.722067,5.9443426,Magnetic fields in high-energy astrophysics,0.024888211157520976
6.6845965,6.986582,Neon abundance and analysis in astronomy,0.003211857352280345
2.9536688,8.792296,Antennae Galaxies (NGC 4038/4039),0.0015101622871960339
7.705314,6.728553,Electron-cyclotron maser radiation,0.00603328250348074
9.240401,4.374124,Solar neutrinos,0.002272610076097446
10.053532,7.582119,Discrete Dipole Approximation (DDA) in DDSCAT,0.0018858611976691935
8.474397,10.892199,Kinetic Inductance Detectors (KIDs),0.002353643174434794
3.6856291,7.7868986,RR Lyrae stars in astronomy research,0.020328257714719293
5.6570187,9.886655,Dust and molecular structures in near-IR,0.07990968492858037
11.57441,6.6248455,Non-gravitational forces and cosmological measurements,0.0012633796695322916
8.894962,8.757927,Precession in astronomical objects,0.004456820408554148
4.4903107,7.8370833,BL Lac object S5 0716+714,0.004990902193050307
10.292692,10.396222,Astronomy Education and Outreach,0.00282879179650379
10.383829,7.9261346,Efficient computation of correlation functions,0.0024346762727721423
4.8218484,7.052522,γ Cas stars and X-ray emissions,0.0014438624794654762
7.981866,10.754496,H2O maser astrometry with VLBI,0.00659683086919048
5.706385,11.396411,Europa's geophysical and geological processes,0.0013996626076451045
4.204026,6.7271724,Coalescence of compact binary systems,0.006265331830537691
10.398491,6.472173,"Presence of ""zero"" in context",0.003801188976551968
8.224206,7.14665,Specific chemical processes in astrophysical environments,0.006755213743213478
6.767408,4.2311525,Coronal rain phenomenon,0.004357370696958312
8.843096,6.2365847,Prandtl number in convection/turbulence,0.006191665377503738
9.449261,9.990929,Positional accuracy and errors,0.025610142397253715
7.8473716,8.486016,CHIANTI atomic database,0.0024346762727721423
6.798454,11.07309,Alice UV spectrograph on comet 67P,0.0006224815281369018
3.5766895,9.287313,Malin 1 Galaxy,0.0027735419567283255
6.0316005,12.251472,Transiting Exoplanets,0.0008029643380700862
6.3228984,4.6827626,Sunspot Penumbra,0.0034328567113822038
9.752458,6.831335,Equation of State (EOS),0.005097718549949538
9.129652,10.796783,Astronomy Instrumentation and Technology,0.0018932278429725888
9.38209,10.465236,Prototypes of telescope systems and performance metrics,0.003116090963336206
9.610668,3.6795418,Zel'dovich Pancakes,0.000898730727014225
4.329941,6.4308004,Eclipsing binaries in Persei clusters,0.0014070292529484998
11.136103,6.9956555,Averaging in cosmology,0.017337399721540806
7.49685,9.84104,Maunakea Spectroscopic Explorer (MSE),0.004331587438396429
7.1552386,5.1179395,Solar Energetic Particles (SEPs),0.0033849735169101344
6.02975,11.403852,Cassini mission's infrared studies of Titan,0.003749622459428201
10.460818,8.790866,Advanced computational techniques in astrophysics,0.002548859274974769
5.728183,8.342331,Narrow-Line Seyfert 1 Galaxies,0.008644758263534369
8.131009,7.341484,Pulse profiles in astrophysical phenomena,0.011841882325207923
7.3057966,10.151933,MIDI mid-infrared interferometry,0.0015101622871960339
8.927824,6.5151854,Dynamic interactions and influences,0.0037790890406417823
9.384098,10.987057,CONCERTO instrument and related research,0.0019153277788827746
4.3456054,6.4042835,Eclipsing binary stars and phenomena,0.0017937781313767524
10.630872,8.779809,High-performance computing in astrophysics,0.001745894936904683
6.7677727,5.2509713,Solar flares observed by SDO/EVE,0.001333362799914547
4.38639,7.8858695,BL Lacertae and AR Lacertae objects,0.006530531061459921
6.608569,5.4293923,Solar phenomena and measurement techniques,0.0022799767214008414
8.503618,6.3208957,Electron-impact excitation in plasma diagnostics,0.0035875562627535047
8.478301,5.3085775,Ankle feature in cosmic ray spectrum,0.0012375964109704082
5.6016574,11.470093,Enceladus plumes and geophysical processes,0.002324176593221213
4.926514,7.4557023,Young variable stars monitoring,0.01646076893043677
6.5686584,5.0969377,Solar cycles and related phenomena,0.01541102197470294
3.2072177,5.5102496,Kilonovae from neutron star mergers,0.004843569286982401
5.6072154,6.7040944,TeV gamma-ray blazar flaring activity,0.0017937781313767524
4.1361785,5.347964,Pulsars and their properties,0.06403456429976354
9.285803,10.7781925,Commissioning of astronomical instruments,0.002471509499289119
8.4599695,5.981999,High-energy proton-proton interactions and particle production,0.007318762108923217
9.068886,7.9005394,Epoch of Reionization 21 cm power spectrum,0.0031455575445497874
5.88239,7.744886,Changing-look AGNs and variability,0.004464187053857544
6.871103,8.984964,Radio emission from ultracool dwarfs,0.002843525087110581
6.2293596,9.614456,ESO surveys and galaxy properties,0.007123546008383243
8.517578,7.2839108,Earth effects on astrophysical phenomena,0.021532704221824423
6.361784,8.125671,[O III] emission lines in AGNs,0.004419987182037172
7.336657,9.781579,ELAIS (European Large Area ISO Survey),0.004224771081497197
8.765435,7.0601873,Channeling in astrophysical contexts,0.010169653841337193
3.8842182,9.721421,Properties of bars in galaxies,0.006972529779663639
9.99865,9.911068,Communication in Astronomical Research,0.0022357768495804694
8.29297,7.1607814,Decline in astrophysical phenomena,0.010247003617022844
10.197989,3.833393,CDMS experiment and dark matter detection,0.009256189823716178
11.727042,6.438694,Gravitational Potential in Astrophysics,0.033654519068561366
4.254951,9.81486,Bulges in galaxies,0.0074734616602945185
10.740569,8.257381,Bayesian model selection in astronomy,0.001620661966746963
9.31546,9.682933,Accurate positional measurements in astronomy,0.0014585957700722668
5.9068513,8.0046215,Baldwin effect in AGNs,0.0020921272661642613
7.4514623,6.1701026,Love numbers and tidal deformability,0.0013701960264315234
8.418943,2.618662,Gravitational Lensing and Supernova Refsdal,0.002924558185447929
4.771503,7.050651,Goldstone bosons,0.004291070889227755
10.68281,8.723349,Parallel computing with MPI,0.0014180792209035928
4.1881886,8.097589,Blue Straggler Stars in Clusters,0.003952205205271572
10.508171,4.437835,Higgs portal dark matter models,0.0021989436230634932
5.578081,8.596957,Methanol masers in star formation,0.0015727787722748937
6.8682127,8.210368,Interstellar complex organic molecules chemistry,0.002408893014210259
4.538548,9.521112,Galactic conformity and related properties,0.0007992810154183887
6.085335,7.1461535,Atoll sources' island and banana states,0.004607836637273752
6.8975086,10.376872,Celestial events and observational campaigns,0.006416348059257295
6.0941753,12.136097,Coronagraphs for exoplanet detection,0.0033518236130448556
5.019858,9.534287,Tully-Fisher relation,0.0032044907069769496
8.786676,8.0641165,Optical polarization plane rotations in blazars,0.0017385282916012876
6.6883683,6.8889656,Lithium abundances in stars,0.003841705525720642
11.709864,6.6975684,Modified Newtonian Dynamics (MOND),0.0039669384958783615
3.429241,9.039751,M82 Galaxy,0.004467870376509242
5.7766814,8.514915,Lyman Break Galaxies (LBGs),0.006187982054852041
10.426065,4.2791934,Dark Matter Models and Properties,0.006062749084694321
7.1387806,5.0042796,Filaments in cosmic and solar contexts,0.01919011101534472
8.37565,5.155434,KASCADE-Grande experiment and cosmic rays,0.0021805270098050047
4.609051,7.122538,Boson stars and related phenomena,0.0014512291247688715
5.1018133,7.109823,Pollux's magnetic field and RV variations,0.002209993591018586
4.8306804,5.998425,X-ray/gamma-ray black hole binaries outbursts,0.003583872940101807
10.50581,7.060413,High-order methods/theories,0.01586407066086175
7.9286036,7.234211,Compton scattering in astrophysics,0.002232093526928772
9.337472,4.3164477,Sterile neutrinos and their implications,0.0026483089865706054
10.506611,7.8467484,Advanced theoretical models and simulations,0.00301664125174037
6.606329,5.343429,Parker Solar Probe observations and predictions,0.0014659624153756622
9.672004,9.898004,Robotic systems in astronomy,0.0025009760805027
9.04103,7.310142,Hall effect in astrophysics,0.0019374277147929605
5.821872,10.758835,Thermophysical modeling of main-belt asteroids,0.004747802898038262
4.929401,9.553405,Faber-Jackson relation in galaxies,0.0018674445844107052
7.5500917,9.682285,X-shooter instrument,0.0040111383676987335
8.587051,4.9942245,Large High Altitude Air Shower Observatory (LHAASO),0.0012154964750602222
3.7335804,7.810312,RR Lyrae stars in globular clusters,0.005856483016199253
7.4615703,5.411214,Magnetic Helicity,0.003874855429585921
4.4842896,5.5146794,Accreting Millisecond X-ray Pulsars (AMXPs),0.0024641428539857236
8.114003,8.003352,Blue astronomical phenomena,0.035768746270635816
9.27387,4.4100556,Neutrinos from supernovae,0.00475148622068996
9.591207,7.6038923,β parameter in astrophysics,0.025282326681252625
9.324156,7.099475,Self-Organized Criticality in Astrophysics,0.0026998755036943727
6.7286263,4.867157,Hemispheric asymmetry in solar activity,0.0018821778750174958
6.5299244,5.417749,Solar surface motions using SDO/HMI data,0.0024641428539857236
7.987455,7.9236145,Outbursts in Astronomical Objects,0.0026740922451324893
10.3781805,9.0173855,Advanced computational techniques in astronomy,0.002291026689355934
4.5453396,5.5151286,Anomalous X-ray Pulsars (AXPs) and Magnetars,0.0020921272661642613
7.7863665,9.253044,Fermi GBM and related studies,0.004596786669318659
6.6937957,6.986655,Oxygen abundance in astronomy,0.012350180851142199
7.3877378,6.255329,Tidal interactions in planetary systems,0.004191621177631918
5.171313,9.277608,Radio relics in galaxy clusters,0.0023794264329966776
5.62689,3.9499152,Hawking Radiation,0.002033194103737099
8.412395,8.759724,"""meso-"" prefix in astronomy terms",0.0033518236130448556
7.59611,5.7812386,Spin-down mechanisms in magnetic fields,0.007996493476835584
6.442134,5.025991,Solar cycles and sunspot predictions,0.007160379234900219
10.35263,6.0103674,Next-to-leading order calculations,0.0016685451612190325
9.404426,10.499936,Evryscope telescope and its features,0.0009355639535312014
10.55575,4.30027,"Dark Matter, Dark Energy, Computational Methods",0.0021142272020744472
4.8164215,8.321166,Taurus star-forming region,0.004733069607431472
6.6867876,9.8604555,J-PAS survey and photometric system,0.0003646489425180667
3.0976574,5.5911636,Kilonovae,0.0014917456739375456
7.471748,7.218926,Calcium (Ca) in astronomical contexts,0.01778676508504792
5.808123,11.451938,Saturn/Titan polar atmospheric features,0.001974260941309937
4.9363813,8.961352,Galactic fountains and water fountain nebulae,0.0012118131524085248
4.684617,7.31272,KIC 8462852 (Boyajian's Star) Dimming Events,0.001826928035242031
7.3085656,5.8562865,Magnetic fields in stars,0.0022799767214008414
9.5741415,6.228219,Sachs-Wolfe effect,0.0029282415080996264
7.2486553,5.6972027,Alfvén waves,0.0077791774403854225
4.3741856,6.4272637,Eclipses in astronomy,0.0019889942319167276
7.7358046,6.5931754,Nuclear reaction rates in astrophysics,0.0016169786440952654
8.694267,4.271253,ANTARES deep-sea neutrino telescope,0.00225051014018726
3.750553,8.416877,Orion Trapezium Cluster Studies,0.0007219312397327381
8.841787,6.7171416,Speed of sound in dense matter,0.007536078145373378
8.295146,6.2342587,PeVatrons and ultra-high-energy gamma rays,0.0012154964750602222
8.487677,5.057648,Tunka-Rex cosmic-ray radio detection,0.001539628868409615
4.601034,7.8512135,Scorpius constellation objects,0.005878582952109439
8.571865,6.6436176,Cosmological and high-energy astrophysical phenomena,0.0017716781954665664
5.6381726,10.525735,Kozai-Lidov mechanism in orbital dynamics,0.0015248955778028243
7.421972,9.761512,Spectroscopic surveys and observations,0.005779133240513603
3.5122333,9.136546,IC 1613 galaxy,0.0038269722351138517
7.5164094,5.332222,Flux measurements in astrophysics,0.10163392192829307
10.268097,3.7908547,Directional detection of dark matter with MIMAC,0.001167613280588153
11.508525,6.328952,Kinetic Field Theory (KFT),0.0015322622231062196
7.0966716,6.940996,Metallicity in astrophysical contexts,0.01053430278385526
6.6654587,8.284225,[C II] 158 μm Emission,0.005215584874803863
8.269434,9.481057,Cherenkov Radiation and Techniques,0.0019632109733548437
4.323783,6.763001,"Circumbinary systems (orbits, disks, planets)",0.003863805461630828
9.595833,9.219065,Detection techniques in astrophysics,0.0039080053334512
3.723443,8.5562525,Praesepe cluster,0.0019668942960065416
5.955807,11.804072,MASCARA project and hot Jupiters,0.0013149461866560587
6.764482,5.223141,High-resolution solar magnetic field observations,0.0013296794772628493
5.0213604,9.303364,Mass-Metallicity Relation in Galaxies,0.0017127450330394042
9.272063,4.4417424,Neutrino physics and cosmology,0.04560690107332022
10.285622,7.9984875,Theoretical and computational astrophysics,0.0019779442639616344
6.8286333,9.846336,SDSS Stripe 82 surveys and catalogs,0.0025230760164128858
8.628019,6.59482,Shocks in astrophysical contexts,0.005208218229500468
4.847424,3.3539462,Gravitational waves in compact binaries,0.00179746145402845
4.5089583,6.1221023,Be/X-ray binary systems,0.003399706807516925
7.208441,5.237936,Magnetic field extrapolation in solar atmosphere,0.001499112319240941
7.182372,8.431946,Equivalent Width in Spectral Lines,0.006578414255931991
10.504848,8.554607,Computational methods in astrophysics,0.0016427619026571489
6.34917,7.5958433,TANAMI Program and Relativistic Jets,0.0018232447125903334
6.1656914,11.197169,Kreutz sungrazing comets,0.002604109114750234
8.4161215,7.242625,Physical properties and processes in astrophysics,0.025359676456938277
10.567814,4.2816224,Asymmetric Dark Matter (ADM),0.0016427619026571489
2.8611143,5.740563,<SUP>44</SUP>Ti in supernova remnants,0.0010681635689923166
4.841422,4.7927938,Mountains on neutron stars,0.004169521241721733
7.8006477,9.157761,VERITAS gamma-ray detection results,0.002427309627468747
9.1983185,6.7977176,Instabilities and chaotic behaviors in astrophysical systems,0.0019595276507031463
10.108258,7.7147965,Tracers in astrophysical simulations,0.04181307874207165
10.175188,7.404975,Smoothed Particle Hydrodynamics (SPH),0.004777269479251844
2.9790163,5.8012238,"Recurrent novae, T Pyxidis studies",0.0022394601722321673
9.552981,6.2232566,Sunyaev-Zeldovich Effect and Szekeres Models,0.007071979491259476
8.901101,7.0308056,Settling in astrophysical environments,0.0015101622871960339
10.549623,7.2084866,Variation of fundamental physical constants,0.010567452687720538
7.529846,7.786275,Silica aerogels in astronomy,0.0024751928219408164
6.049728,12.260276,KELT transiting exoplanets,0.001558045481668103
8.296223,7.1050034,Peaks in astrophysical phenomena,0.025322843230421298
5.48443,5.7333193,Gamma-Ray Bursts (GRBs),0.019179061047389628
8.5110235,4.9922776,LOPES experiment and cosmic-ray air showers,0.0013959792849934068
7.4917555,8.976185,Markarian 231 (Mrk 231),0.0016869617744775206
5.8438993,7.300493,3C 273,0.0060958989885596
7.08455,9.706947,Cosmology Large Angular Scale Surveyor (CLASS),0.0012891629280941752
4.792243,7.1142473,AE Aquarii cataclysmic variable star,0.0013259961546111516
8.698338,7.6974883,Radiative feedback on primordial gas clouds,0.003388656839561832
6.5754557,8.467012,Circumgalactic Medium (CGM),0.0024162596595136542
9.554417,8.795201,Mutual Information in Astronomy,0.001974260941309937
7.30723,9.953951,RHESSI-related research and observations,0.0020000441998718204
2.8830419,8.578743,NGC 752 Open Cluster,0.0015433121910613126
10.787844,6.582319,Etherington Distance Duality Relation,0.0022357768495804694
10.516666,7.212123,Variations in fundamental physical constants,0.0023278599158729108
4.381326,6.6198525,Binary systems and their phenomena,0.007742344213868446
7.6108446,11.134333,LISA mission and technologies,0.004361054019610009
4.0317016,6.4057717,"DT fusion, Kuiper Belt resonances, spiral arms, cosmological models, gravitational phenomena, tidal debris, white dwarf binaries.",0.0031897574163701594
11.029179,7.517089,Precise cosmological measurements and estimations,0.30406196822029213
11.741979,6.4303613,"Modified gravity theories, scalar-tensor theories",0.009665038638054617
8.931044,6.5279565,Bullet Cluster dynamics and properties,0.001974260941309937
10.698319,5.914537,Null Energy Condition Violation,0.0034623232925957846
